{
  "$id": "https://quizloop.dev/schema/module.schema.json",
  "$schema": "https://json-schema.org/draft/2020-12/schema",
  "type": "object",
  "properties": {
    "schemaVersion": {
      "type": "number",
      "const": 1
    },
    "id": {
      "type": "string",
      "pattern": "^[a-z0-9][a-z0-9-]{1,63}$"
    },
    "name": {
      "type": "string",
      "minLength": 1
    },
    "version": {
      "type": "string",
      "pattern": "^\\d+\\.\\d+\\.\\d+$"
    },
    "standart": {
      "type": "string",
      "pattern": "^\\d+\\.\\d+\\.\\d+$"
    },
    "language": {
      "default": "tr",
      "type": "string"
    },
    "description": {
      "type": "string"
    },
    "tags": {
      "default": [],
      "maxItems": 12,
      "type": "array",
      "items": {
        "type": "string",
        "pattern": "^[\\p{Ll}\\p{N}][\\p{Ll}\\p{N}-]{0,31}$"
      }
    },
    "source": {
      "type": "object",
      "properties": {
        "title": {
          "type": "string"
        },
        "file": {
          "type": "string"
        },
        "pages": {
          "type": "integer",
          "exclusiveMinimum": 0,
          "maximum": 9007199254740991
        },
        "sayfaOfseti": {
          "default": 0,
          "type": "integer",
          "minimum": -9007199254740991,
          "maximum": 9007199254740991
        },
        "sagdanSola": {
          "type": "boolean"
        },
        "bolumler": {
          "type": "array",
          "items": {
            "type": "object",
            "properties": {
              "bolum": {
                "type": "integer",
                "exclusiveMinimum": 0,
                "maximum": 9007199254740991
              },
              "ilkSayfa": {
                "type": "integer",
                "exclusiveMinimum": 0,
                "maximum": 9007199254740991
              },
              "sonSayfa": {
                "type": "integer",
                "exclusiveMinimum": 0,
                "maximum": 9007199254740991
              },
              "dosya": {
                "type": "string",
                "pattern": "^kaynak\\/bolum\\/[A-Za-z0-9._-]+\\.pdf$"
              }
            },
            "required": [
              "bolum",
              "ilkSayfa",
              "sonSayfa",
              "dosya"
            ]
          }
        }
      },
      "required": [
        "title"
      ]
    },
    "blocks": {
      "minItems": 1,
      "type": "array",
      "items": {
        "type": "object",
        "properties": {
          "file": {
            "type": "string",
            "pattern": "^blocks\\/\\d{4}\\.json$"
          },
          "count": {
            "type": "integer",
            "minimum": 0,
            "maximum": 9007199254740991
          },
          "sha256": {
            "type": "string",
            "minLength": 64,
            "maxLength": 64
          }
        },
        "required": [
          "file",
          "count",
          "sha256"
        ]
      }
    },
    "questionCount": {
      "type": "integer",
      "minimum": 0,
      "maximum": 9007199254740991
    },
    "createdAt": {
      "type": "string",
      "format": "date-time",
      "pattern": "^(?:(?:\\d\\d[2468][048]|\\d\\d[13579][26]|\\d\\d0[48]|[02468][048]00|[13579][26]00)-02-29|\\d{4}-(?:(?:0[13578]|1[02])-(?:0[1-9]|[12]\\d|3[01])|(?:0[469]|11)-(?:0[1-9]|[12]\\d|30)|(?:02)-(?:0[1-9]|1\\d|2[0-8])))T(?:(?:[01]\\d|2[0-3]):[0-5]\\d:[0-5]\\d(?:\\.\\d+)?(?:Z))$"
    }
  },
  "required": [
    "schemaVersion",
    "id",
    "name",
    "version",
    "blocks",
    "questionCount",
    "createdAt"
  ]
}
