{
  "schemaVersion": 1,
  "id": "quizloop-rehberi",
  "name": "QuizLoop Rehberi: Uygulama Nasıl Kullanılır",
  "version": "1.0.3",
  "language": "tr",
  "description": "Modül nedir, nasıl eklenir, oturum nasıl işler, sorular neden geri gelir: uygulamayı soru çözerek öğreten rehber.",
  "tags": [
    "rehber",
    "örnek"
  ],
  "source": {
    "title": "QuizLoop Rehber Notları",
    "file": "notlar.md",
    "pages": 15,
    "sayfaOfseti": 0
  },
  "blocks": [
    {
      "file": "blocks/0001.json",
      "count": 10,
      "sha256": "e669e6ba930603120b47aa4fbbb26bf0bd72c0a4425f446fcd1a06c81817687c"
    },
    {
      "file": "blocks/0002.json",
      "count": 10,
      "sha256": "4a949ba517865e08d39cf53afc316a16f427bcee67bb1c75e6dff48b1b106bfc"
    },
    {
      "file": "blocks/0003.json",
      "count": 10,
      "sha256": "b44c0b7b3d94d2a24c07ebb53a0515fadf3cace2a760eb69af429af19500203e"
    },
    {
      "file": "blocks/0004.json",
      "count": 10,
      "sha256": "a618ed869af15a02a28587afe8ba8850cacb7adfb95e55b6b19697ecf658e1ca"
    }
  ],
  "questionCount": 40,
  "createdAt": "2026-10-04T00:00:00.000Z"
}
